{
  "schema_version": "1.0",
  "run_id": "20261019T230000Z-b2",
  "git_sha": "01e2b86d09a37a1a3d9b5aaaedfc7028fd41e137",
  "layer": 1,
  "model": "d-fine-n",
  "variant": "parity",
  "precision": "fp32",
  "backend": "ort-cpu",
  "tensorrt_version": null,
  "onnx_sha256": "27398cb0dc242a677bbdf96c4dd8ef8fc7436c545c7cb46eb5b8b3d22163ae8b",
  "engine_sha256": null,
  "golden_set": {
    "id": "b2-pit-golden-v1",
    "split": "held-out",
    "inputs": [
      "44fe5f2d3674e3cff689a086a673bb73afefe82c5fe1219685171a2446cd1fdb",
      "e54218f8718a46da0c2ee92384ee14d0102f9deae39cfbebe1bba7622c42d384",
      "967261d42655d8f4aac0ed842501fae29c4a5925d174ad28adf2c2e9650ff7f0",
      "22a1479e2ea0560a45ff29e2704e40e5f786f999057c54271df9eb588c4c1aa8",
      "edb5d19518ce0de5f17e681c6e24de248c3aa82840b0a11c1e5d693e88c84085",
      "9af550628a3b62d2a30b9dc0f0466c16721db9438083262695d7842267d7b54c",
      "3652e43a6dddb5f35e50fb63e7fb7a5863f20e0fc46d2b6be1154a904175d6d7",
      "84bd1f5a6f78bd19bf024a51f607a6b85d4d0de46ad6fcc22c65148edfefbb82",
      "fe33829853f4ec6fcc65d537482cb757c4273b4e0a6eb2921a6033a1a217fb1c",
      "0cbb15122220dbbad8ca914a8e384ff7d103ca1177be2228a02cb7cdf9e1c7ba",
      "b1bfdc49e18d1b11f33cf8a999dccde0489a25678537c05b841350da67f28e5a",
      "18225ceb1c7c22b9b0e808a06ca078df17e802756f131803ef2c09103941fa2c",
      "08c36ddd0bbf4db3696dd9c583dbc9e404d01338150a007c66c9d516db8f493b",
      "d6d6e9bc51737e5d7199dcd681f547be2b164c186bc09ffee347154995cd72fa",
      "9353cc4b0b0ba0bb8779a8a4c4b940385ff72464dbe7b4079ffa5bbeb076585a",
      "31bfbf06f67a6fa8141bc483cc0346a92ecb7d98d030a1c2c91352adda0718af",
      "fe455d5814d2c54ff76c07f855d43cdb7402aa57cb30f117e71b8a681afb8043",
      "59ae37947d00d68522871b46b157519672b0d21a285ffa2312b29503da5c0ffc",
      "d1d7806916adf35305001b2e32d330d2e6f9796ea5df9b1e0d94279f85dfccfa",
      "59ad0970a497d2d1506024fac783edba5476014912ecf525d70e3aecdd84c8ae",
      "9fe7e682e1d27444d24367bfa9cae9a25cf85b71f762534f370ced56fce7a300",
      "ab19862e3ca5fe60792ad83a298b73447db558d540782b25a543601fcadcab44",
      "a16b0e4109f6a1eb915b63cad949e9e51ff18136eb987236f66fb7d502b74d24",
      "0614e886f86959c943cda1ebbf532ea92e3d28ea9c4f34382bc0cd0798da1bfd",
      "ff4cf6021ae44b0281ed552d7295c20e83e6f1dcee1d5323d3d437862274794a",
      "d2c83eca91efad63d0adb536e2a2389f8eeee61a5da2d73d1219da57c4c65502",
      "eb2c03d2146d1d847647640341a4ec1dd4c0eb0965b2c66b3325a2981bcf5f7a",
      "a39861491b070db5eb63a9354889751ed1ca2a07610f1b6120fd93a25ad1e827",
      "9cfb7ab46ed370e5bdc68b12d1c3721aa5cda09b9b1e43e44f9854b10f70ea0d",
      "7db664d049fd83d228a2d8d353ddd7afc3b6a9a0af3ae4626fffda6253ae1793",
      "8989ea028bf3d14c6f3f3106b868635301dd2466fafb6bb0ea0153ef1ccffc7b",
      "3c9dc6aa3de9e3a79e9e13f0ab31656eaba91e240594995bce921d2f0d393615",
      "86df4710da00a973eca3bc1dad99ba10ed0ae63bac855f0755aa9b88bb30eb0b",
      "7e630eb0263f72456bc1b0f7cb4b1abc59778ea42e15950d3d6cf9b7e228e1a8",
      "a548eeb55f42434ef24ad4123732420146a72dd0f6d1f34e670426d19f9b3428",
      "633549eda72194f9a1e641480d8d33b47f0d952ce92222d7f183a3e1d64555ec",
      "a3f57d2226dd4f1c3eaa959082eb8104093886408457b02c7ab0f021e41c1ad1",
      "1df774a9d7a50ac1545e9a9040ebd30bad0aae6c0815a1737329027ccf1b9ec8",
      "8d73c846ea8be5a232f7b5485fd5babe4d3a7242ca4e63bea12e77e38da3fb05",
      "4bc0ec28ff4eed82de81b14ded7a1d7fea11f1a6ece26101ba61252239e0b23e",
      "d163a491b9dd1e2395a5a5d842aa87ed330a332f588c48ce4967734a624bb27c",
      "b4fd7111c4b1f6c6491088d4c6133f5debba9aeb7cbb743bcf2c31ee03f14cf7",
      "26b270d6f0497db434ec315dba159387219b981460040d0a13f389db131b3ccf",
      "920aa1e7079c6f9f913dfc8cc257bdd305cce5139c30025905eb4819f8a86352",
      "8cd71cddce32f0705a835b3c972281c2cbfa51ae1b7f23620e1b998af601bc4f",
      "f8598351d6640c54f7a9b85594bf8e332c1f46317e80f30869d63c04fb0366e9",
      "f03a4e1b6ec4c7ddbb3bd1652b52a4ffa3c7d46f8b86a10a568844cd0a393c12",
      "6cc3069f7f827c32094bd66010c3f8d5ac257935761fb979ec35d0b28320c36b",
      "e99dc6677a576c8df6c6298f375ff809763dfc4c4106235c89ffe90a75ec75ac",
      "6372363a9b829cbaea5de38baa18c74814bb1d3fbb2605a365456b1b6e0f9d8d",
      "06d66188bbdd01c636188f6ef601047474a7de5bb2542c704c395ba0e937e61f",
      "f9aca2e4d2912fa8fad1f68c40a8a8bd2b9fa7570e8b2295d4db779e7be6d186",
      "7cbbe22ff99ee4335e5917fdec9f88a404635c68019dfc72b3550a124643b9a4",
      "9d7dcda31ff33bc0d0d10611eefbf9d0a1553759f7400401dfe50028565495b3",
      "3551c08149fada59335a1da0175f776d4ca4b1676e642f7c63d93548eeb59011",
      "9b6f5862c631e02479845aaf6e91c0b3842df5cebd2e7b3b01bff9021778c5e1",
      "90e2295d83e6975b5e13e600a1400477775d097d107d9c6cb0ba34c2af8ad316",
      "3c8ed4e54be91ad1ad90beaaa6a580e04a2105b2b3e4a95ab8d1ce718b08b4ce",
      "dcbb746138d6d8b6092f49f712625fa36d619b7e11bbe4d5a6d5f06a7430e2bd",
      "cca49f0162e8a6d6010b43404548443b722c8f78446885cc388580f885f0635e",
      "8c27a4fda8c9567af55624a7f1d4116408ec05c01a451894e575361b05e1b44f",
      "729a86a1cde441b6346998424e5a1a2b1df4edc6346dfeee204805a11cf6c53a",
      "a2304e813a5202d219eb52172e77af6a75ad3a73d67aa3b9ce2f8dea3a8eae92",
      "a475e39a1e039386058ed79d5d866f822d2b98b7735dc44c9a690203de4c859d",
      "6b0ef97a1f6ad96607316718b5c0307557c30e0df861578e344df7cad3291d17",
      "fba180976aa273ccd8524e4fa556e3de939bcac84cb963c7c4b8a08d98c15d11",
      "299b0dc99c52ddc4069982a0fdc0153e7b27b25ac18180b7a2e2ff9dadfce837",
      "0a253acbf6fd28dbb00153b4913e20a0fde86653c8358eec6439980fb34d39f2",
      "bd6daed87d36239a78ff915047066c11393cbe294c9963ee4dec39f36a413e97",
      "6178d64a1be7bb42158bd8e48011c8ae7ed306dd12388e803995895ebe5220a3",
      "c8a29151190bba12b0f9a270eeb14182a4db83d31b3441a250ec1f9500dccc96",
      "b4d0eaea70456db1f7e0d423f7205ece8b5a5813c88b7c9d80d6e38c9993a285",
      "2c19a6c92157db18fa30415a3190af7090507b3fc971a2d04a7d87f099f925eb",
      "7ff7126cecc4f852a1f611089e70847251483c1dc87e7f663c44eb5f46ae21bf",
      "b7234200f47d529a5c1c10bfd84450cf2c16684bf37333050560228e70c52366",
      "0b4aef021fc2c9363000c424187a47e3ee179a56fa56a700d7d4e6f030e0b1e5",
      "5412f5b2206ef4ad699729f37af9601d538f9a5a56952d10484a135ffb2ebf42",
      "7d6ca7b3be21ddc64562bc7b660196f4325252630900d04500b6b3343460e452",
      "69da354d33141153b66e5f9162eaf147c136599bf82ce43e7c2a1f50983897d6",
      "78cfed28216b1fa2c23f6bff8b5a2fd4c1ada41bc301b229fc770f950d52a417",
      "25fc9748db39f07d2db1c0f53b35c1f154bc24172182b3e129aa350ff84425ad",
      "9e501dce1608d04d7adb6aec338cddac0f2dd2387ea260eead9b17b28b8242cb",
      "177c78c530765d920ff0438769af84c4df8bcbb8b422ca58ac320da2dc4e5bd9",
      "996b584ba8d34459fb93a68b465c45497fa4cb27dc27152ffd6485c56835669a",
      "ce02461570a7a91ca32ba1bae1a78a7c7591ac4171687fa6360dd29642bf9491",
      "a92929b268b88a53392a84d0089d250dc5ebba97ad72ae47b28bcdd5aa2d4e19",
      "536912d0d56712a6b4b5fcb9f301ec3b6da65e80038a6e634112e52b66bdcb3e",
      "548e1e2e2c783fee69c515168475701d8f0f6beb7e5805a59c29cd8f12ad84e0",
      "164d50700ca177135f648d7f978b86e1c607f28d688fbaa3d8b2d2e0a8ac608f",
      "bd55e2795359d76cfab22b0670044bb09824a775c5fc3325676c7214901edef6",
      "a859352ef29d63272d54095f90ebbb7387827f0951762d42ed911641aa287c57",
      "c7465968be612f94142b4d0913ef75d892dc06d37142c1ed6cca8b1575b356bb",
      "d2d9c9d639240cba81771e15fe28ca01593906b91d102a79de8bd42dcca14119",
      "6904aa0eaf841246f224b1bd60a3edcf51966ad5ec8090ea161e81afc45822e5",
      "0c80def93b6424905784f01738d709a2bbc8a10d24d167095cf142381231dfd3",
      "165d273950092c65bc3929e8c55e82811fae2acc249457fa3cf169f1171c3843",
      "21eb51f8bb81670094d358f25e6ac4efe13f0ddd8a8cea5495241b6a7648fab7",
      "49f2db2af5f1f5ca6a08d9e303c433e07dc7b2c13ac988a96f6ddeeb8d51e64d",
      "b198c569615fe3715f3a267e5ab1629cce4fdc0346a54215596a0c4dbf0d12dc",
      "c73ebb5ef811ec979a3d3cfc41879df66fa681c372e5e27690dc03a602532b7f",
      "957a19e8cb326b0d42cc13fae3b28ac9d37efce25a9678e309d0067eb1486f9a",
      "89cfc4f324c9b583e67c31a5853da6faea5f668d4bbcbd284d0889d93ca08682",
      "1c6eb281af5c8470b20d4de0c9210aaecc2431353224957f34d92ad222b035d3",
      "d2da96639cbcc3f6ff8b8ba3a3913a26f284188d22f819f4de836edb1d7ca2de",
      "bdee43d8d9f9550ef82218ff0bc17167844e16522e99acc28b8d10f1736f27c9",
      "57c724191996b68553e6a2412cb42bde06333e02ef4c28bffcd4e99b6e07d354",
      "5caa0fa7d3cd5f6679660d8408601560607f64454603ef7c02a73ad74c343a27",
      "2be4fb836ff3ae5215a1a41fb0a9ba386ba3e13933284d25f3c61bca8a6fb3c9",
      "e775f89beb52fb1cc303fb9c97fe6155d34f3002c54cd141b26166f32d6686b9",
      "8a9f19a88c43be4088b320fb2385738e5a532d50cacc759e15bd7c19df7705a6",
      "1cb5229bc3ee35b94f030aef6a943aef78499585ec3041a96a039399e16a7e1b",
      "84587bed912fe0c203c6cdcf515a402d0d66647f48688356da6e7e6594aa49a4",
      "92fa5aa541888cd0af78b075041948c6ed3cac05d5925e0a22d2abd17053f77f",
      "bff0bf16a427e8ea18569b98d1dbd1ee79630a152b6ee0a65f511c59088fef36",
      "9a80096451d631c26bf1ca15c61ea626f2b501b7cf10933713d426ced70d02b2",
      "535d97107da63aac08e73168c3dc7503766fa0db8a5f0205f173b4ee50a250dd",
      "b92c87d5bd082bdf13db37d51191b4d9b3b6d21f3c0f9dc8f93f84f2816afa49",
      "26c43618c02743e9ba56e292566f4fa9120d6bd06b86bef50516d282cda3926b",
      "6e1647c000f2790009ca39b10e5258fcadf052a563b5fe52ffb75acb92398304",
      "1dcfccca0694ee25f837312d6525de0ac1d5106422f70cc7063206180aa9def8",
      "6a84f16511b16c678f21ff49e1871b0bd2cf750eaca4ec6d6601fc16637d127b",
      "d8a32baca1184db64be9bd181dc89810ba4ae853b82b4620a2e276078274e6f6",
      "3f2c918125e2abb91b90b015ffb9191e193e661ea19bcca931dea74e4f9b31d3",
      "d6660e3af1678549c4d69d2a9eed289d8d8cc2029d6288c830e62e1268074007",
      "58febdf1300edc32db567392fa8a2a9bdd03ef2cea1478a64804dd3eab55d9da",
      "524677a142fd8399e57bbb43c9f0fd456ccd2d5e9a041b20dbf1c19baaba3161",
      "0e229c675d7e07d797426c346d21a972c210d5bf4537af5debdb839b0abf2085",
      "9736dfa2577bbd61a49f607054b150441daabc132297f36661da49cb77411935",